{
  "$schema": "https://json-schema.org/draft/2020-12/schema",
  "$id": "https://behaverse.org/schemas/viewer_conformance/v26.0603/schema.json",
  "title": "Behaverse Viewer Conformance Manifest",
  "description": "Per OD-18c (resolved 2026-06-03), a per-viewer JSON document declaring supported features. Stored in the Viewer Service's viewer-registry table; hashed into the runtime cache key.",
  "type": "object",
  "required": ["viewer_id", "viewer_version", "schema_support", "evaluator", "widgets", "scorer_impl_kinds"],
  "properties": {
    "viewer_id":         { "type": "string", "pattern": "^[a-z][a-z0-9-]*$" },
    "viewer_version":    { "type": "string", "pattern": "^v\\d{2}\\.\\d{4}$" },
    "schema_support": {
      "type": "object",
      "required": ["questionnaire", "instrument"],
      "properties": {
        "questionnaire": { "type": "array", "items": { "type": "string", "pattern": "^v\\d{2}\\.\\d{4}$" }, "minItems": 1 },
        "instrument":    { "type": "array", "items": { "type": "string", "pattern": "^v\\d{2}\\.\\d{4}$" }, "minItems": 1 },
        "runtime":       { "type": "array", "items": { "type": "string", "pattern": "^v\\d{2}\\.\\d{4}$" }, "minItems": 1 },
        "response":      { "type": "array", "items": { "type": "string", "pattern": "^v\\d{2}\\.\\d{4}$" } },
        "session":       { "type": "array", "items": { "type": "string", "pattern": "^v\\d{2}\\.\\d{4}$" } }
      },
      "additionalProperties": false
    },
    "evaluator": {
      "type": "object",
      "required": ["language_version", "functions"],
      "properties": {
        "language_version": { "type": "string" },
        "functions":        { "type": "array", "items": { "type": "string" }, "uniqueItems": true }
      },
      "additionalProperties": false
    },
    "widgets": {
      "type": "array",
      "items": { "type": "string" },
      "uniqueItems": true,
      "minItems": 1
    },
    "behavioural_channels": {
      "type": "array",
      "items": { "type": "string", "enum": ["response_time", "mouse", "keyboard", "webcam", "microphone"] },
      "uniqueItems": true
    },
    "scorer_impl_kinds": {
      "type": "array",
      "items": { "type": "string", "enum": ["wasm", "http", "python", "r"] },
      "uniqueItems": true,
      "minItems": 1
    },
    "logic_actions": {
      "type": "array",
      "items": { "type": "string", "enum": ["skip", "visibility", "piping", "branch"] },
      "uniqueItems": true
    },
    "locale_switching":             { "type": "boolean" },
    "resume":                       { "type": "boolean" },
    "max_session_duration_minutes": { "type": "integer", "minimum": 1 },
    "viewer_url":                   { "type": "string", "format": "uri" },
    "extensions":                   { "type": "object" }
  },
  "additionalProperties": false,
  "patternProperties": { "^x_": {} }
}
